
UC 1: Create a payroll service database

mysql> show databases;
+--------------------+
| Database           |
+--------------------+
| bridgelab          |
| information_schema |
| mysql              |
| performance_schema |
| sys                |
+--------------------+
5 rows in set (0.00 sec)

mysql> create database Payroll_Service;
Query OK, 1 row affected (0.00 sec)

mysql> show databases;
+--------------------+
| Database           |
+--------------------+
| bridgelab          |
| information_schema |
| mysql              |
| payroll_service    |
| performance_schema |
| sys                |
+--------------------+
6 rows in set (0.00 sec)

mysql> use payroll_service;
Database changed
mysql> SELECT DATABASE();
+-----------------+
| DATABASE()      |
+-----------------+
| payroll_service |
+-----------------+
1 row in set (0.00 sec)

***********************************************************************************************************************

UC 2: Create a employee payroll table in the payroll service database

mysql> create table payroll_service(
    -> id int unsigned not null auto_increment,
    -> name varchar(50) not null,
    -> salary double not null,
    -> start_date DATE not null,
    -> Primary Key(id)
    -> );
Query OK, 0 rows affected (0.06 sec)

mysql> desc payroll_service;
+------------+--------------+------+-----+---------+----------------+
| Field      | Type         | Null | Key | Default | Extra          |
+------------+--------------+------+-----+---------+----------------+
| id         | int unsigned | NO   | PRI | NULL    | auto_increment |
| name       | varchar(50)  | NO   |     | NULL    |                |
| salary     | double       | NO   |     | NULL    |                |
| start_date | date         | NO   |     | NULL    |                |
+------------+--------------+------+-----+---------+----------------+
4 rows in set (0.00 sec)

********************************************************************************************************************

UC 3: Create employee payroll data in the payroll service database as part of CRUD Operation

mysql> insert into payroll_service(id, name, salary, start_date) values(10, 'Azhar', 300000.00, '2020-01-01'),
    -> (11, 'Ajju', 150000.00, '2020-07-13'),
    -> (12, 'Simran', 2000000.00, '2021-12-12');
Query OK, 3 rows affected (0.04 sec)
Records: 3  Duplicates: 0  Warnings: 0

******************************************************************************************************************

UC 4: Retrieve all the employee payroll data

mysql> select * from payroll_service;
+----+--------+---------+------------+
| id | name   | salary  | start_date |
+----+--------+---------+------------+
| 10 | Azhar  |  300000 | 2020-01-01 |
| 11 | Ajju   |  150000 | 2020-07-13 |
| 12 | Simran | 2000000 | 2021-12-12 |
+----+--------+---------+------------+
3 rows in set (0.00 sec)

******************************************************************************************************************

UC 5: Retrieve salary data for a particular employee as well as all employees who have joined in a particular data range

mysql> select salary FROM payroll_service WHERE name = 'Azhar';
+--------+
| salary |
+--------+
| 300000 |
+--------+
1 row in set (0.00 sec)

mysql> select salary FROM payroll_service WHERE name = 'Ajju';
+--------+
| salary |
+--------+
| 150000 |
+--------+
1 row in set (0.00 sec)

mysql> select salary FROM payroll_service WHERE name = 'Simran';
+---------+
| salary  |
+---------+
| 2000000 |
+---------+
1 row in set (0.00 sec)

******************************************************************************************************************

UC 6: add Gender to Employee Payroll Table and Update the Rows to reflect the correct Employee Gender

mysql> alter table payroll_service add gender char(1) AFTER name;
Query OK, 0 rows affected (0.06 sec)
Records: 0  Duplicates: 0  Warnings: 0

mysql> select * from payroll_service;
+----+--------+--------+---------+------------+
| id | name   | gender | salary  | start_date |
+----+--------+--------+---------+------------+
| 10 | Azhar  | NULL   |  300000 | 2020-01-01 |
| 11 | Ajju   | NULL   |  150000 | 2020-07-13 |
| 12 | Simran | NULL   | 2000000 | 2021-12-12 |
+----+--------+--------+---------+------------+
3 rows in set (0.00 sec)

mysql> update payroll_service set gender = 'M' where name = "Azhar" or name = "Ajju";
Query OK, 2 rows affected (0.04 sec)
Rows matched: 2  Changed: 2  Warnings: 0

mysql> update payroll_service set gender = 'F' where name = "Simran";
Query OK, 1 row affected (0.04 sec)
Rows matched: 1  Changed: 1  Warnings: 0

mysql> select * from payroll_service;
+----+--------+--------+---------+------------+
| id | name   | gender | salary  | start_date |
+----+--------+--------+---------+------------+
| 10 | Azhar  | M      |  300000 | 2020-01-01 |
| 11 | Ajju   | M      |  150000 | 2020-07-13 |
| 12 | Simran | F      | 2000000 | 2021-12-12 |
+----+--------+--------+---------+------------+
3 rows in set (0.00 sec)

******************************************************************************************************************

UC 7: Find sum, average, min, max and number of male and female employees

mysql> alter table payroll_service add gender char(1) AFTER name;
Query OK, 0 rows affected (0.06 sec)
Records: 0  Duplicates: 0  Warnings: 0

mysql> select * from payroll_service;
+----+--------+--------+---------+------------+
| id | name   | gender | salary  | start_date |
+----+--------+--------+---------+------------+
| 10 | Azhar  | NULL   |  300000 | 2020-01-01 |
| 11 | Ajju   | NULL   |  150000 | 2020-07-13 |
| 12 | Simran | NULL   | 2000000 | 2021-12-12 |
+----+--------+--------+---------+------------+
3 rows in set (0.00 sec)

mysql> update payroll_service set gender = 'M' where name = "Azhar" or name = "Ajju";
Query OK, 2 rows affected (0.04 sec)
Rows matched: 2  Changed: 2  Warnings: 0

mysql> update payroll_service set gender = 'F' where name = "Simran";
Query OK, 1 row affected (0.04 sec)
Rows matched: 1  Changed: 1  Warnings: 0

mysql> select * from payroll_service;
+----+--------+--------+---------+------------+
| id | name   | gender | salary  | start_date |
+----+--------+--------+---------+------------+
| 10 | Azhar  | M      |  300000 | 2020-01-01 |
| 11 | Ajju   | M      |  150000 | 2020-07-13 |
| 12 | Simran | F      | 2000000 | 2021-12-12 |
+----+--------+--------+---------+------------+
3 rows in set (0.00 sec)

mysql> select sum(salary) from payroll_service;
+-------------+
| sum(salary) |
+-------------+
|     2450000 |
+-------------+
1 row in set (0.04 sec)

mysql> select max(salary) from payroll_service;
+-------------+
| max(salary) |
+-------------+
|     2000000 |
+-------------+
1 row in set (0.04 sec)

mysql> select min(salary) from payroll_service;
+-------------+
| min(salary) |
+-------------+
|      150000 |
+-------------+
1 row in set (0.00 sec)

mysql> select avg(salary) from payroll_service;
+-------------------+
| avg(salary)       |
+-------------------+
| 816666.6666666666 |
+-------------------+
1 row in set (0.00 sec)

mysql> select count(salary) from payroll_service;
+---------------+
| count(salary) |
+---------------+
|             3 |
+---------------+
1 row in set (0.05 sec)

mysql> select sum(salary) from payroll_service where gender = 'M' group by gender;
+-------------+
| sum(salary) |
+-------------+
|      450000 |
+-------------+
1 row in set (0.00 sec)

mysql> select avg(salary) from payroll_service where gender = 'M' group by gender;
+-------------+
| avg(salary) |
+-------------+
|      225000 |
+-------------+
1 row in set (0.00 sec)

mysql> select sum(salary) from payroll_service where gender = 'F' group by gender;
+-------------+
| sum(salary) |
+-------------+
|     2000000 |
+-------------+
1 row in set (0.00 sec)

mysql> select * from payroll_service where gender = 'M' group by gender;
+----+-------+--------+--------+------------+
| id | name  | gender | salary | start_date |
+----+-------+--------+--------+------------+
| 10 | Azhar | M      | 300000 | 2020-01-01 |
+----+-------+--------+--------+------------+
1 row in set (0.00 sec)

mysql> select gender, sum(salary) from payroll_service group by gender;
+--------+-------------+
| gender | sum(salary) |
+--------+-------------+
| M      |      450000 |
| F      |     2000000 |
+--------+-------------+
2 rows in set (0.04 sec)

mysql> select gender, avg(salary) from payroll_service group by gender;
+--------+-------------+
| gender | avg(salary) |
+--------+-------------+
| M      |      225000 |
| F      |     2000000 |
+--------+-------------+
2 rows in set (0.04 sec)

mysql> select gender, count(name) from payroll_service group by gender;
+--------+-------------+
| gender | count(name) |
+--------+-------------+
| M      |           2 |
| F      |           1 |
+--------+-------------+
2 rows in set (0.00 sec)

mysql> select gender, count(salary) from payroll_service group by gender;
+--------+---------------+
| gender | count(salary) |
+--------+---------------+
| M      |             2 |
| F      |             1 |
+--------+---------------+
2 rows in set (0.00 sec)

mysql> select gender, count(gender) from payroll_service group by gender;
+--------+---------------+
| gender | count(gender) |
+--------+---------------+
| M      |             2 |
| F      |             1 |
+--------+---------------+
2 rows in set (0.00 sec)

******************************************************************************************************************

UC 8: Extend employee_payroll data to store employee information like employee phone, address and department

mysql> alter table payroll_service add phone_number bigint after name;
Query OK, 0 rows affected (0.01 sec)
Records: 0  Duplicates: 0  Warnings: 0

mysql> alter table payroll_service add address varchar(50) after phone_number;
Query OK, 0 rows affected (0.02 sec)
Records: 0  Duplicates: 0  Warnings: 0

mysql> alter table payroll_service add department varchar(120) not null after address;
Query OK, 0 rows affected (0.01 sec)
Records: 0  Duplicates: 0  Warnings: 0

mysql> select * from payroll_service;
+----+--------+--------------+---------+------------+--------+---------+------------+
| id | name   | phone_number | address | department | gender | salary  | start_date |
+----+--------+--------------+---------+------------+--------+---------+------------+
| 10 | Azhar  |         NULL | NULL    |            | M      |  300000 | 2020-01-01 |
| 11 | Ajju   |         NULL | NULL    |            | M      |  150000 | 2020-07-13 |
| 12 | Simran |         NULL | NULL    |            | F      | 2000000 | 2021-12-12 |
+----+--------+--------------+---------+------------+--------+---------+------------+
3 rows in set (0.00 sec)

mysql> desc payroll_service;
+--------------+--------------+------+-----+---------+----------------+
| Field        | Type         | Null | Key | Default | Extra          |
+--------------+--------------+------+-----+---------+----------------+
| id           | int unsigned | NO   | PRI | NULL    | auto_increment |
| name         | varchar(50)  | NO   |     | NULL    |                |
| phone_number | bigint       | YES  |     | NULL    |                |
| address      | varchar(50)  | YES  |     | NULL    |                |
| department   | varchar(120) | NO   |     | NULL    |                |
| gender       | char(1)      | YES  |     | NULL    |                |
| salary       | double       | NO   |     | NULL    |                |
| start_date   | date         | NO   |     | NULL    |                |
+--------------+--------------+------+-----+---------+----------------+
8 rows in set (0.00 sec)

******************************************************************************************************************

UC 9: Extend employee_payroll table to have Basic Pay, Deductions, Taxable Pay, Income Tax, Net Pay

mysql> alter table payroll_service add basic_pay double not null after salary;
Query OK, 0 rows affected (0.02 sec)
Records: 0  Duplicates: 0  Warnings: 0

mysql> alter table payroll_service add deductions double not null after basic_pay;
Query OK, 0 rows affected (0.02 sec)
Records: 0  Duplicates: 0  Warnings: 0

mysql> alter table payroll_service add taxable_pay double not null after deductions;
Query OK, 0 rows affected (0.01 sec)
Records: 0  Duplicates: 0  Warnings: 0

mysql> alter table payroll_service add income_tax double not null after taxable_pay;
Query OK, 0 rows affected (0.02 sec)
Records: 0  Duplicates: 0  Warnings: 0

mysql> alter table payroll_service add net_pay double not null after income_tax;
Query OK, 0 rows affected (0.03 sec)
Records: 0  Duplicates: 0  Warnings: 0

mysql> desc payroll_service;
+--------------+--------------+------+-----+---------+----------------+
| Field        | Type         | Null | Key | Default | Extra          |
+--------------+--------------+------+-----+---------+----------------+
| id           | int unsigned | NO   | PRI | NULL    | auto_increment |
| name         | varchar(50)  | NO   |     | NULL    |                |
| phone_number | bigint       | YES  |     | NULL    |                |
| address      | varchar(50)  | YES  |     | NULL    |                |
| department   | varchar(120) | NO   |     | NULL    |                |
| gender       | char(1)      | YES  |     | NULL    |                |
| salary       | double       | NO   |     | NULL    |                |
| basic_pay    | double       | NO   |     | NULL    |                |
| deductions   | double       | NO   |     | NULL    |                |
| taxable_pay  | double       | NO   |     | NULL    |                |
| income_tax   | double       | NO   |     | NULL    |                |
| net_pay      | double       | NO   |     | NULL    |                |
| start_date   | date         | NO   |     | NULL    |                |
+--------------+--------------+------+-----+---------+----------------+
13 rows in set (0.00 sec)

mysql> select * from payroll_service;
+----+--------+--------------+---------+------------+--------+---------+-----------+------------+-------------+------------+---------+------------+
| id | name   | phone_number | address | department | gender | salary  | basic_pay | deductions | taxable_pay | income_tax | net_pay | start_date |
+----+--------+--------------+---------+------------+--------+---------+-----------+------------+-------------+------------+---------+------------+
| 10 | Azhar  |         NULL | NULL    |            | M      |  300000 |         0 |          0 |           0 |          0 |       0 | 2020-01-01 |
| 11 | Ajju   |         NULL | NULL    |            | M      |  150000 |         0 |          0 |           0 |          0 |       0 | 2020-07-13 |
| 12 | Simran |         NULL | NULL    |            | F      | 2000000 |         0 |          0 |           0 |          0 |       0 | 2021-12-12 |
+----+--------+--------------+---------+------------+--------+---------+-----------+------------+-------------+------------+---------+------------+
3 rows in set (0.00 sec)

******************************************************************************************************************

UC 10: Make Terissa as part of Sales and Marketing Department

mysql> insert into payroll_service(name, phone_number, address, department, gender, salary, basic_pay, deductions, taxable_pay, income_tax, net_pay, start_date) values( "Terrisa", null, null, "Marketing", 'F', 1000000, 0, 0, 0, 0, 0, "2022-05-01");
Query OK, 1 row affected (0.01 sec)

mysql> select * from payroll_service;
+----+---------+--------------+---------+------------+--------+---------+-----------+------------+-------------+------------+---------+------------+
| id | name    | phone_number | address | department | gender | salary  | basic_pay | deductions | taxable_pay | income_tax | net_pay | start_date |
+----+---------+--------------+---------+------------+--------+---------+-----------+------------+-------------+------------+---------+------------+
| 10 | Azhar   |         NULL | NULL    |            | M      |  300000 |         0 |          0 |           0 |          0 |       0 | 2020-01-01 |
| 11 | Ajju    |         NULL | NULL    |            | M      |  150000 |         0 |          0 |           0 |          0 |       0 | 2020-07-13 |
| 12 | Simran  |         NULL | NULL    |            | F      | 2000000 |         0 |          0 |           0 |          0 |       0 | 2021-12-12 |
| 13 | Terrisa |         NULL | NULL    | Marketing  | F      | 1000000 |         0 |          0 |           0 |          0 |       0 | 2022-05-01 |
+----+---------+--------------+---------+------------+--------+---------+-----------+------------+-------------+------------+---------+------------+
4 rows in set (0.00 sec)

mysql> show tables;
+---------------------------+
| Tables_in_payroll_service |
+---------------------------+
| payroll_service           |
+---------------------------+
1 row in set (0.04 sec)

mysql> create table company;
ERROR 4028 (HY000): A table must have at least one visible column.
mysql> create table company
    -> (company_id int primary key,
    -> company_name varchar(20) not null
    -> );
Query OK, 0 rows affected (0.02 sec)

mysql> desc company;
+--------------+-------------+------+-----+---------+-------+
| Field        | Type        | Null | Key | Default | Extra |
+--------------+-------------+------+-----+---------+-------+
| company_id   | int         | NO   | PRI | NULL    |       |
| company_name | varchar(20) | NO   |     | NULL    |       |
+--------------+-------------+------+-----+---------+-------+
2 rows in set (0.00 sec)

mysql> insert into company(company_ID, company_name) values(100, 'Google');
Query OK, 1 row affected (0.01 sec)

mysql> select * from company;
+------------+--------------+
| company_id | company_name |
+------------+--------------+
|        100 | Google       |
+------------+--------------+
1 row in set (0.00 sec)

mysql> create table employee;
ERROR 4028 (HY000): A table must have at least one visible column.
mysql> create table employee1;
ERROR 4028 (HY000): A table must have at least one visible column.
mysql> create table employee1(
    -> id int unsigned not null auto_increment,
    -> name varchar(10) not null,
    -> salary double not null,
    -> company_id int,
    -> foreign key(company_id) references company(company_id),
    -> primary key(id)
    -> );
Query OK, 0 rows affected (0.04 sec)

mysql> desc employee1;
+------------+--------------+------+-----+---------+----------------+
| Field      | Type         | Null | Key | Default | Extra          |
+------------+--------------+------+-----+---------+----------------+
| id         | int unsigned | NO   | PRI | NULL    | auto_increment |
| name       | varchar(10)  | NO   |     | NULL    |                |
| salary     | double       | NO   |     | NULL    |                |
| company_id | int          | YES  | MUL | NULL    |                |
+------------+--------------+------+-----+---------+----------------+
4 rows in set (0.00 sec)

mysql> insert into employee1( name, salary, company_ID) values
    -> ( 'Afifa', 50000, 786);
Query OK, 1 row affected (0.17 sec)

mysql> select * from employee;
+----+--------+--------+------------+
| id | name   | salary | company_ID |
+----+--------+--------+------------+
|  1 | Afifa  |  50000 |        786 |
+----+--------+--------+------------+
1 row in set (0.00 sec)

mysql> show tables;
+---------------------------+
| Tables_in_payroll_service |
+---------------------------+
| company                   |
| employee1                 |
| payroll_service           |
+---------------------------+
3 rows in set (0.04 sec)
4 rows in set (0.00 sec)